Company Name,Title,Description,Location,Started On,Finished On
Movares,Lead Software Developer,"Lead Developer in multiple teams, specializing in the Data and Energy domains. Key projects and responsibilities include:•	Spearheaded the design and development of Python microservices and APIs, ensuring efficient and scalable solutions.•	Led the creation of infrastructure to maintain a robust Kubernetes cluster, enabling seamless deployment and management of applications.•	Undertook full-stack development of a Web Cloud Energy application, utilizing both Python and .NET technologies. The application accurately calculates the inductive influence of cables or pipelines on surrounding objects•	 Implemented and optimized infrastructure and CI/CD pipelines, streamlining the development and deployment processes. •	Achieved significant performance, integration, and efficiency improvements for applications and both SQL and NoSQL databases. •	Facilitated multiple department-wide trainings and workshops, equipping team members with the latest tools and techniques. Skills: C# · Python · TypeScript · Kubernetes · Docker · .NET Core · PostgreSQL · Terraform · Kibana · Grafana · YAML · Helm · Service Bus · Cosmos DB · Angular · Microsoft Azure · CI/CD · End-to-End (E2E) Testing","Utrecht, Netherlands",Jan 2020,
Deloitte,Scrum Master/ Senior Software Developer,"Responsible for design, implementation and releases of multiple Tax related applications. The part of responsibilities includes:•	Leading development team of 6 people. •	 Introduction of code style guidelines and code reviews. •	Both front and back end development of various Tax related applications.•	Migration of applications to Azure. •	Test coverage and release pipelines improvements.Skills: Microsoft Azure · CI/CD · C# · .NET Core · Microsoft SQL Server · Entity Framework · LINQ · TypeScript · Pipelines · JavaScript · AngularJS · Vue.js · HTML · Cascading Style Sheets (CSS) · SpecFlow","Amsterdam Area, Netherlands",May 2018,Jan 2020
CXO Solutions,Scrum Master/ Senior Software Developer,"Take both technical and process lead role in the development team. Responsible for designing the product architecture as well as facilitating the development process. The part of achievements and responsibilities includes:•	Leading the distributed team consisting of developers and testers. •	Facilitating Agile scrum events, helping the development team to deliver the required high quality product within the required time frame. •	Full stack development of Reporting application, displaying  key finance information for the users. •	2nd Line Customer support helping to resolve the issues in the timely manner. Skills: C# · Microsoft SQL Server · Dependency Injection · Entity Framework · TypeScript · .NET Framework · React.js · AngularJS · MDX · SSAS · HTML · SpecFlow","Utrecht Area, Netherlands",Oct 2012,May 2018
Infostrada Sports,Software Developer,"•	Development of Incidents Registration System, a management tool that provides operation departments with data problems analysis through performance views and reports.  •	Maintenance and development of Bio application which is used by researchers worldwide for providing the information about the athletes. Infostrada Sports delivers detailed athlete biographies to the leading sport competitions including Vancouver Olympic Winter Games, Beijing 2008 Olympic Games etc. •	Tasks and responsibilities: detailed design, algorithmic implementation, SQL stored procedures and triggers development, database modeling and optimization. Skills: C# · MS SQL Server · Microsoft SQL Server · .NET Framework · Visual Studio","Nieuwegein, The Netherlands",Jan 2011,Oct 2012
Acision,Software Developer,"•	Participated in various projects related to Acision’s Central Management Station, a management tool that provides operation departments with a real-time analysis of their messaging infrastructure through alarms, operational status updates, performance views and reports.  •	Maintenance and unit testing of the component of Acision’s Open Services Architecture which provides messaging-technology functionality. Skills: C++ · Eclipse · XML · Synergy · Oracle Database · SNMP · Internet Protocol Suite (TCP/IP)","Nieuwegein, The Netherlands",Jan 2009,Sep 2010
CQG,C++ Software Developer/Process Coach,"•	Participated in various order-routing and electronic trading projects for futures, options, Globex currencies, indices, treasuries, and exchange traded spreads. •	Development and maintenance of different types of charts with flexible time and price scaling, analytical studies and tools.  •	Managed and analyzed the work and productivity of several teams in terms of company development processes and metrics. Organized extensive training program for new employees, which included software development processes and lifecycle, principles accepted in the company, time and risk management strategies. Skills: Microsoft SQL Server · C++ · Design Patterns · Boost C++ · Microsoft Project · WTL · MFC","Samara Region, Russian Federation",May 2006,Nov 2008
